cora/leelaz_opencl_tuning
0;XgemmBatched;192;16;192;16; -DKWG=32 -DKWI=2 -DMDIMA=16 -DMDIMC=16 -DMWG=32 -DNDIMB=8 -DNDIMC=8 -DNWG=16 -DSA=1 -DSB=1 -DSTRM=0 -DSTRN=0 -DVWM=2 -DVWN=1;OpenCL: AMD AMD Radeon Pro 450 Compute Engine @ 300MHz
0;XgemmBatched;192;16;192;16; -DKWG=32 -DKWI=2 -DMDIMA=16 -DMDIMC=16 -DMWG=32 -DNDIMB=8 -DNDIMC=8 -DNWG=16 -DSA=1 -DSB=1 -DSTRM=0 -DSTRN=0 -DVWM=2 -DVWN=2;OpenCL: AMD AMD Radeon Pro 450 Compute Engine @ 800MHz
0;XgemmBatched;128;16;128;16; -DKWG=32 -DKWI=2 -DMDIMA=16 -DMDIMC=16 -DMWG=32 -DNDIMB=8 -DNDIMC=8 -DNWG=16 -DSA=1 -DSB=1 -DSTRM=0 -DSTRN=0 -DVWM=2 -DVWN=2;OpenCL: AMD AMD Radeon Pro 450 Compute Engine @ 300MHz
0;XgemmBatched;64;16;64;16; -DKWG=32 -DKWI=2 -DMDIMA=8 -DMDIMC=8 -DMWG=16 -DNDIMB=16 -DNDIMC=16 -DNWG=16 -DSA=1 -DSB=1 -DSTRM=0 -DSTRN=0 -DVWM=2 -DVWN=1;OpenCL: AMD AMD Radeon Pro 450 Compute Engine @ 800MHz
0;XgemmBatched;128;16;128;16; -DKWG=32 -DKWI=2 -DMDIMA=16 -DMDIMC=16 -DMWG=32 -DNDIMB=8 -DNDIMC=8 -DNWG=16 -DSA=1 -DSB=1 -DSTRM=0 -DSTRN=0 -DVWM=2 -DVWN=2;OpenCL: AMD AMD Radeon Pro 450 Compute Engine @ 800MHz
